{
  "query_registry_sha256": "8a53a2f506218f72abeb961fa4692a8bd250cac92087a44e0b3ab1b6c620fa1c",
  "rankings": [
    {
      "candidates": [
        {
          "case_id": "atmel-atmega328p-7810d-2015-01/pinout-positive",
          "score": 7.0
        },
        {
          "case_id": "atmel-atmega328p-7810d-2015-01/package-positive",
          "score": 6.0
        },
        {
          "case_id": "atmel-atmega328p-7810d-2015-01/table-positive",
          "score": 5.0
        },
        {
          "case_id": "atmel-atmega328p-7810d-2015-01/wrong-figure-package-as-pinout",
          "score": 4.0
        },
        {
          "case_id": "atmel-atmega328p-7810d-2015-01/wrong-package",
          "score": 3.0
        },
        {
          "case_id": "atmel-atmega328p-7810d-2015-01/wrong-variant",
          "score": 2.0
        },
        {
          "case_id": "atmel-atmega328p-7810d-2015-01/wrong-view",
          "score": 1.0
        }
      ],
      "query_id": "atmel-atmega328p-7810d-2015-01/pinout-query-1"
    },
    {
      "candidates": [
        {
          "case_id": "atmel-atmega328p-7810d-2015-01/table-positive",
          "score": 7.0
        },
        {
          "case_id": "atmel-atmega328p-7810d-2015-01/package-positive",
          "score": 6.0
        },
        {
          "case_id": "atmel-atmega328p-7810d-2015-01/pinout-positive",
          "score": 5.0
        },
        {
          "case_id": "atmel-atmega328p-7810d-2015-01/wrong-figure-package-as-pinout",
          "score": 4.0
        },
        {
          "case_id": "atmel-atmega328p-7810d-2015-01/wrong-package",
          "score": 3.0
        },
        {
          "case_id": "atmel-atmega328p-7810d-2015-01/wrong-variant",
          "score": 2.0
        },
        {
          "case_id": "atmel-atmega328p-7810d-2015-01/wrong-view",
          "score": 1.0
        }
      ],
      "query_id": "atmel-atmega328p-7810d-2015-01/table-query-1"
    },
    {
      "candidates": [
        {
          "case_id": "atmel-atmega328p-7810d-2015-01/package-positive",
          "score": 7.0
        },
        {
          "case_id": "atmel-atmega328p-7810d-2015-01/pinout-positive",
          "score": 6.0
        },
        {
          "case_id": "atmel-atmega328p-7810d-2015-01/table-positive",
          "score": 5.0
        },
        {
          "case_id": "atmel-atmega328p-7810d-2015-01/wrong-figure-package-as-pinout",
          "score": 4.0
        },
        {
          "case_id": "atmel-atmega328p-7810d-2015-01/wrong-package",
          "score": 3.0
        },
        {
          "case_id": "atmel-atmega328p-7810d-2015-01/wrong-variant",
          "score": 2.0
        },
        {
          "case_id": "atmel-atmega328p-7810d-2015-01/wrong-view",
          "score": 1.0
        }
      ],
      "query_id": "atmel-atmega328p-7810d-2015-01/package-query-1"
    },
    {
      "candidates": [
        {
          "case_id": "atmel-mxt336t-rev-3-1-bx-2016-10/pinout-positive",
          "score": 7.0
        },
        {
          "case_id": "atmel-mxt336t-rev-3-1-bx-2016-10/package-positive",
          "score": 6.0
        },
        {
          "case_id": "atmel-mxt336t-rev-3-1-bx-2016-10/table-positive",
          "score": 5.0
        },
        {
          "case_id": "atmel-mxt336t-rev-3-1-bx-2016-10/wrong-figure-schematic-as-pinout",
          "score": 4.0
        },
        {
          "case_id": "atmel-mxt336t-rev-3-1-bx-2016-10/wrong-package",
          "score": 3.0
        },
        {
          "case_id": "atmel-mxt336t-rev-3-1-bx-2016-10/wrong-variant",
          "score": 2.0
        },
        {
          "case_id": "atmel-mxt336t-rev-3-1-bx-2016-10/wrong-view",
          "score": 1.0
        }
      ],
      "query_id": "atmel-mxt336t-rev-3-1-bx-2016-10/pinout-query-1"
    },
    {
      "candidates": [
        {
          "case_id": "atmel-mxt336t-rev-3-1-bx-2016-10/table-positive",
          "score": 7.0
        },
        {
          "case_id": "atmel-mxt336t-rev-3-1-bx-2016-10/package-positive",
          "score": 6.0
        },
        {
          "case_id": "atmel-mxt336t-rev-3-1-bx-2016-10/pinout-positive",
          "score": 5.0
        },
        {
          "case_id": "atmel-mxt336t-rev-3-1-bx-2016-10/wrong-figure-schematic-as-pinout",
          "score": 4.0
        },
        {
          "case_id": "atmel-mxt336t-rev-3-1-bx-2016-10/wrong-package",
          "score": 3.0
        },
        {
          "case_id": "atmel-mxt336t-rev-3-1-bx-2016-10/wrong-variant",
          "score": 2.0
        },
        {
          "case_id": "atmel-mxt336t-rev-3-1-bx-2016-10/wrong-view",
          "score": 1.0
        }
      ],
      "query_id": "atmel-mxt336t-rev-3-1-bx-2016-10/table-query-1"
    },
    {
      "candidates": [
        {
          "case_id": "atmel-mxt336t-rev-3-1-bx-2016-10/package-positive",
          "score": 7.0
        },
        {
          "case_id": "atmel-mxt336t-rev-3-1-bx-2016-10/pinout-positive",
          "score": 6.0
        },
        {
          "case_id": "atmel-mxt336t-rev-3-1-bx-2016-10/table-positive",
          "score": 5.0
        },
        {
          "case_id": "atmel-mxt336t-rev-3-1-bx-2016-10/wrong-figure-schematic-as-pinout",
          "score": 4.0
        },
        {
          "case_id": "atmel-mxt336t-rev-3-1-bx-2016-10/wrong-package",
          "score": 3.0
        },
        {
          "case_id": "atmel-mxt336t-rev-3-1-bx-2016-10/wrong-variant",
          "score": 2.0
        },
        {
          "case_id": "atmel-mxt336t-rev-3-1-bx-2016-10/wrong-view",
          "score": 1.0
        }
      ],
      "query_id": "atmel-mxt336t-rev-3-1-bx-2016-10/package-query-1"
    },
    {
      "candidates": [
        {
          "case_id": "bosch-bme280-rev-1-23-2022-01/pinout-positive",
          "score": 7.0
        },
        {
          "case_id": "bosch-bme280-rev-1-23-2022-01/package-positive",
          "score": 6.0
        },
        {
          "case_id": "bosch-bme280-rev-1-23-2022-01/table-positive",
          "score": 5.0
        },
        {
          "case_id": "bosch-bme280-rev-1-23-2022-01/wrong-figure-block-as-pinout",
          "score": 4.0
        },
        {
          "case_id": "bosch-bme280-rev-1-23-2022-01/wrong-package",
          "score": 3.0
        },
        {
          "case_id": "bosch-bme280-rev-1-23-2022-01/wrong-variant",
          "score": 2.0
        },
        {
          "case_id": "bosch-bme280-rev-1-23-2022-01/wrong-view",
          "score": 1.0
        }
      ],
      "query_id": "bosch-bme280-rev-1-23-2022-01/pinout-query-1"
    },
    {
      "candidates": [
        {
          "case_id": "bosch-bme280-rev-1-23-2022-01/table-positive",
          "score": 7.0
        },
        {
          "case_id": "bosch-bme280-rev-1-23-2022-01/package-positive",
          "score": 6.0
        },
        {
          "case_id": "bosch-bme280-rev-1-23-2022-01/pinout-positive",
          "score": 5.0
        },
        {
          "case_id": "bosch-bme280-rev-1-23-2022-01/wrong-figure-block-as-pinout",
          "score": 4.0
        },
        {
          "case_id": "bosch-bme280-rev-1-23-2022-01/wrong-package",
          "score": 3.0
        },
        {
          "case_id": "bosch-bme280-rev-1-23-2022-01/wrong-variant",
          "score": 2.0
        },
        {
          "case_id": "bosch-bme280-rev-1-23-2022-01/wrong-view",
          "score": 1.0
        }
      ],
      "query_id": "bosch-bme280-rev-1-23-2022-01/table-query-1"
    },
    {
      "candidates": [
        {
          "case_id": "bosch-bme280-rev-1-23-2022-01/package-positive",
          "score": 7.0
        },
        {
          "case_id": "bosch-bme280-rev-1-23-2022-01/pinout-positive",
          "score": 6.0
        },
        {
          "case_id": "bosch-bme280-rev-1-23-2022-01/table-positive",
          "score": 5.0
        },
        {
          "case_id": "bosch-bme280-rev-1-23-2022-01/wrong-figure-block-as-pinout",
          "score": 4.0
        },
        {
          "case_id": "bosch-bme280-rev-1-23-2022-01/wrong-package",
          "score": 3.0
        },
        {
          "case_id": "bosch-bme280-rev-1-23-2022-01/wrong-variant",
          "score": 2.0
        },
        {
          "case_id": "bosch-bme280-rev-1-23-2022-01/wrong-view",
          "score": 1.0
        }
      ],
      "query_id": "bosch-bme280-rev-1-23-2022-01/package-query-1"
    },
    {
      "candidates": [
        {
          "case_id": "bosch-bmi160-rev-1-0-2020-11/pinout-positive",
          "score": 7.0
        },
        {
          "case_id": "bosch-bmi160-rev-1-0-2020-11/package-positive",
          "score": 6.0
        },
        {
          "case_id": "bosch-bmi160-rev-1-0-2020-11/table-positive",
          "score": 5.0
        },
        {
          "case_id": "bosch-bmi160-rev-1-0-2020-11/wrong-figure-block-as-pinout",
          "score": 4.0
        },
        {
          "case_id": "bosch-bmi160-rev-1-0-2020-11/wrong-package",
          "score": 3.0
        },
        {
          "case_id": "bosch-bmi160-rev-1-0-2020-11/wrong-variant",
          "score": 2.0
        },
        {
          "case_id": "bosch-bmi160-rev-1-0-2020-11/wrong-view",
          "score": 1.0
        }
      ],
      "query_id": "bosch-bmi160-rev-1-0-2020-11/pinout-query-1"
    },
    {
      "candidates": [
        {
          "case_id": "bosch-bmi160-rev-1-0-2020-11/table-positive",
          "score": 7.0
        },
        {
          "case_id": "bosch-bmi160-rev-1-0-2020-11/package-positive",
          "score": 6.0
        },
        {
          "case_id": "bosch-bmi160-rev-1-0-2020-11/pinout-positive",
          "score": 5.0
        },
        {
          "case_id": "bosch-bmi160-rev-1-0-2020-11/wrong-figure-block-as-pinout",
          "score": 4.0
        },
        {
          "case_id": "bosch-bmi160-rev-1-0-2020-11/wrong-package",
          "score": 3.0
        },
        {
          "case_id": "bosch-bmi160-rev-1-0-2020-11/wrong-variant",